{
    "$schema": "http://json-schema.org/draft-07/schema#",
    "title": "ShortTermMemory",
    "type": "object",
    "properties": {
      "id": { "type": "string" },
      "role": { "type": "string", "enum": ["user", "assistant", "system"] },
      "content": { "type": "string" },
      "timestamp": { "type": "string", "format": "date-time" },
      "project_id": { "type": "string" },
      "metadata": {
        "type": "object",
        "properties": {
          "conversation_id": { "type": "string" },
          "file_path": { "type": "string" },
          "function_name": { "type": "string" },
          "line_start": { "type": "integer" },
          "line_end": { "type": "integer" },
          "intent": { "type": "string" },
          "keywords": { "type": "array", "items": { "type": "string" } },
          "embedding": { "type": "array", "items": { "type": "number" } },
          "ttl": { "type": "integer" }
        },
        "required": ["conversation_id", "embedding"]
      }
    },
    "required": ["id", "role", "content", "timestamp", "project_id", "metadata"]
  }
  