[
  {
    "id": "stm_159519954a50",
    "role": "user",
    "content": "Hàm computeMetrics bị lỗi chia cho 0, làm sao sửa?",
    "timestamp": "2025-10-01T14:03:20.424573",
    "project_id": "innocody-demo",
    "metadata": {
      "conversation_id": "conv_8e9148de",
      "embedding": [
        0.012906387432502608,
        0.7799168933552585,
        0.6404800304016638,
        0.857656711487032,
        0.10981911302955383,
        0.49894712400965546,
        0.8877810197117493,
        0.6607719926217902,
        0.11749971312621266,
        0.4061949156697703,
        0.712596091645185,
        0.4468844297241199,
        0.7821361973153736,
        0.7021814871110035,
        0.3668841350712334,
        0.9248235402332252,
        0.7453960382927649,
        0.927522270906051,
        0.4672880876586418,
        0.8737447284181094,
        0.16695564773066562,
        0.8715211139330267,
        0.5456044443483097,
        0.3909003759835368,
        0.7876695168725069,
        0.7286801147177363,
        0.7584422519399536,
        0.9505285382842351,
        0.1320412715874315,
        0.9901257621415874,
        0.51073587126187,
        0.9792411631924163,
        0.8729434159891112,
        0.008782107946605389,
        0.37964219559322254,
        0.9907174015531175,
        0.5292830765104631,
        0.7445037773959527,
        0.45583649064406095,
        0.404049452044851,
        0.9714018317445791,
        0.16459856049927135,
        0.796230732206195,
        0.8353110013038156,
        0.4300458460785168,
        0.32286855584152174,
        0.09586868744069033,
        0.707693233298751,
        0.8449417246643505,
        0.30764630859903075,
        0.33971080008934373,
        0.5218488765503495,
        0.9630465647274228,
        0.33683288441218684,
        0.23087578619428983,
        0.49318881917181345,
        0.23881902612470995,
        0.6076280343711514,
        0.5375697916346065,
        0.9821383176092774,
        0.4413510752978831,
        0.4933587818685563,
        0.7644842495015964,
        0.7470335786249916,
        0.8351359825256623,
        0.3944838993159121,
        0.6113206565503532,
        0.6492105668674253,
        0.6049458097543006,
        0.8095233579108266,
        0.1570622392860972,
        0.8921756293294673,
        0.27917327487386423,
        0.8098971425918304,
        0.949590470126998,
        0.07112511463530413,
        0.7529219514774557,
        0.7279790222796015,
        0.1918298642576748,
        0.846820685711831,
        0.9207765768070885,
        0.8864225608504638,
        0.5455315612854021,
        0.2560041703805215,
        0.5894104158556684,
        0.40245975355905794,
        0.5929469960403265,
        0.41705537726557096,
        0.4730999679854285,
        0.5900138300035234,
        0.7408690048599911,
        0.43359590296625483,
        0.5503121908069888,
        0.5605020291439408,
        0.26225044696789124,
        0.45163446539609065,
        0.6407075659777519,
        0.8701375564321805,
        0.1430285747956983,
        0.5572680132485218,
        0.45318601573822825,
        0.15908482688939152,
        0.08138354986141438,
        0.6389800706757843,
        0.2672251202020913,
        0.09345169122347763,
        0.5051009863944453,
        0.15090330746299352,
        0.6949585504313125,
        0.2559567201455395,
        0.15794955161486246,
        0.6590861692358579,
        0.8459580505122785,
        0.49933888238714985,
        0.247325909431662,
        0.2779457704220084,
        0.654952631538876,
        0.8415961201411823,
        0.9415151251720715,
        0.49789779322436034,
        0.40456575043905607,
        0.32557014750796986,
        0.21899635907869597,
        0.8370691584016843,
        0.915679885475604,
        0.7650693797942678,
        0.9608485304291172,
        0.8650371591155063,
        0.34980338344332196,
        0.34430435767290546,
        0.5305559866028935,
        0.9307312746652838,
        0.6536533848433296,
        0.9229424355632694,
        0.015572194808485373,
        0.3082330040490108,
        0.4684364405889797,
        0.8877699343768614,
        0.08568410552038441,
        0.5014724424039231,
        0.5854799834995157,
        0.22030646620243033,
        0.5094586451542362,
        0.18430638327838722,
        0.48119332782561797,
        0.2039912892918846,
        0.033885459234993864,
        0.09354848452427167,
        0.8111805824739183,
        0.23919565009242805,
        0.21426490385569652,
        0.4272208481472235,
        0.27054284308603427,
        0.24405920858824437,
        0.2894280235247422,
        0.06708008825046186,
        0.9765923051120388,
        0.140139467096423,
        0.9997053654359015,
        0.18605192295388095,
        0.9954781388883002,
        0.014405338924999733,
        0.6128468587641858,
        0.6552430685031352,
        0.4506241174192166,
        0.07911171023285768,
        0.8701578858542705,
        0.5237472729669554,
        0.675010918822539,
        0.38256797428223777,
        0.915769834620567,
        0.2113490165395684,
        0.5901653757610256,
        0.06356118688187484,
        0.4426691838982948,
        0.8964637356358217,
        0.9964922450575219,
        0.7903154507312958,
        0.3383394912328386,
        0.6891198305790684,
        0.3513355211127849,
        0.6780307982527134,
        0.37574606533748345,
        0.7058520029355949,
        0.17456248862180412,
        0.6526842287184178,
        0.13255971761447394,
        0.9651243812640126,
        0.9141371468650272,
        0.088980310202455,
        0.22533043576044365,
        0.8935993332088101,
        0.6508286540868977,
        0.026607739560780552,
        0.031778362466181376,
        0.21038754085047084,
        0.43349327316567376,
        0.9345347903960737,
        0.8198172072984169,
        0.4773124371256824,
        0.41567581632026773,
        0.9442686926403673,
        0.1622872239544455,
        0.5141293548054018,
        0.614556425865083,
        0.1233302398961027,
        0.5259788855279423,
        0.9632452599981068,
        0.047470628263237336,
        0.27500982298977183,
        0.4510488861523779,
        0.5951801092658938,
        0.590980772837292,
        0.8037768290449588,
        0.5903307725199157,
        0.8644543597265453,
        0.025021948828139462,
        0.7809261269400153,
        0.9109862679216013,
        0.2921718718784765,
        0.1254573838657832,
        0.23841500772125845,
        0.7511419252284003,
        0.5351259233187654,
        0.9600611841336005,
        0.15425134017339936,
        0.6615143011018142,
        0.382672535074433,
        0.4688032737415516,
        0.3274087301398273,
        0.6049198906386387,
        0.2868494413055862,
        0.37106656602949595,
        0.6284141643310746,
        0.9932518981897286,
        0.8847509038143396,
        0.06407870284547323,
        0.3206775771508693,
        0.6708947795266502,
        0.9644266396656989,
        0.9775154791705697,
        0.22941823237534487,
        0.5037542554082909,
        0.5215686774063302,
        0.008015930377867964,
        0.637882842649283,
        0.7347914447181718,
        0.7902738563648232,
        0.588482403982612,
        0.7834696615963016,
        0.8262385539615231,
        0.41373792892144,
        0.09261272682621147,
        0.8334496257305085,
        0.39171669945020793,
        0.69060426614312,
        0.9054646304444953,
        0.04315362330007322,
        0.493449735768975,
        0.40842128782200215,
        0.16620166335207764,
        0.2587509866289516,
        0.23000044014900622,
        0.41741221959603014,
        0.08898615751046957,
        0.502374970422354,
        0.7392424232616669,
        0.5616651865475868,
        0.5059617728236715,
        0.011934056239444879,
        0.30295214051317887,
        0.1724794727543133,
        0.4312050441001576,
        0.4840565687385231,
        0.06121918723502562,
        0.5206446608257418,
        0.4616868727242045,
        0.6997837377294357,
        0.6312626610306596,
        0.021369442852005816,
        0.3288880381438264,
        0.6502659201508808,
        0.7999955534714189,
        0.04248009793826035,
        0.8503432706042711,
        0.5807691233978121,
        0.6322931317284066,
        0.8080123773791658,
        0.589160035213732,
        0.3099260228906787,
        0.5608504228821671,
        0.14705534683592925,
        0.3948788396053988,
        0.9392447689979181,
        0.9760026144821575,
        0.7692159986915587,
        0.17305428935295175,
        0.6327013719473851,
        0.03781928236232435,
        0.08365017315002621,
        0.8106265782883815,
        0.7423967619083407,
        0.5927215552510604,
        0.5905326096409519,
        0.31194300197294667,
        0.2588850903628809,
        0.8303523581133953,
        0.09259211644047127,
        0.2679735490725563,
        0.3895856039939385,
        0.02902247612708775,
        0.1976805856892111,
        0.8309304795819611,
        0.08747992370931235,
        0.12033476429922019,
        0.046502652460080895,
        0.3880974656844173,
        0.6872855338662276,
        0.37409896728971614,
        0.28708510546437394,
        0.7095313523167528,
        0.38505648746493504,
        0.3732558296717948,
        0.44133234684006883,
        0.9178368428701319,
        0.006892061115061687,
        0.4123082960490203,
        0.17350472524450888,
        0.9208961349032548,
        0.16261896617675098,
        0.4193911595324855,
        0.39504084515757176,
        0.9456500312959323,
        0.4981797035783342,
        0.5490260931267439,
        0.07715079852996409,
        0.9114274370040168,
        0.4462568707655983,
        0.8301239490140251,
        0.3802400800196579,
        0.9992082134944376,
        0.7831566994239496,
        0.20212361132643808,